Server [localhost]:
Database [postgres]:
Port [5432]:
Username [postgres]:
Password for user postgres:
psql (14.7)
WARNING: Console code page (437) differs from Windows code page (1252)
         8-bit characters might not work correctly. See psql reference
         page "Notes for Windows users" for details.
Type "help" for help.

postgres=# \c new_practice_db
You are now connected to database "new_practice_db" as user "postgres".
new_practice_db=# \dt
          List of relations
 Schema |   Name   | Type  |  Owner
--------+----------+-------+----------
 public | accounts | table | postgres
(1 row)


new_practice_db=# \d accounts
                                  Table "public.accounts"
 Column  |          Type          | Collation | Nullable |             Default
---------+------------------------+-----------+----------+----------------------------------
 id      | integer                |           | not null | generated by default as identity
 name    | character varying(100) |           | not null |
 balance | numeric(15,2)          |           | not null |
Indexes:
    "accounts_pkey" PRIMARY KEY, btree (id)


new_practice_db=# SELECT * FROM accounts
new_practice_db-# q
new_practice_db-# SELECT * FROM accounts;
ERROR:  syntax error at or near "SELECT"
LINE 3: SELECT * FROM accounts;
        ^
new_practice_db=# SELECT * FROM accounts;
 id |    name     |  balance
----+-------------+------------
  1 | Suraj       |   10000.00
  2 | Suraj Aswal | 4000000.00
(2 rows)


new_practice_db=# INSERT INTO accounts(name, balance) VALUES("John Doe", 500000);
ERROR:  column "John Doe" does not exist
LINE 1: INSERT INTO accounts(name, balance) VALUES("John Doe", 50000...
                                                   ^
new_practice_db=# INSERT INTO accounts(name, balance) VALUES("John Doe", 500000);
ERROR:  column "John Doe" does not exist
LINE 1: INSERT INTO accounts(name, balance) VALUES("John Doe", 50000...
                                                   ^
new_practice_db=# INSERT INTO accounts(name, balance) VALUES('John', 5000);
INSERT 0 1
new_practice_db=# SELECT * FROM accounts;
 id |    name     |  balance
----+-------------+------------
  1 | Suraj       |   10000.00
  2 | Suraj Aswal | 4000000.00
  3 | John        |    5000.00
(3 rows)


new_practice_db=# BEGIN;
BEGIN
new_practice_db=*# UPDATE accounts SET balance = balance + 1000 WHERE id=2;
UPDATE 1
new_practice_db=*# SELECT * FROM accounts;
 id |    name     |  balance
----+-------------+------------
  1 | Suraj       |   10000.00
  3 | John        |    5000.00
  2 | Suraj Aswal | 4001000.00
(3 rows)


new_practice_db=*# UPDATE accounts SET balance = balance - 1000 WHERE id=1;
UPDATE 1
new_practice_db=*# SELECT * FROM accounts;
 id |    name     |  balance
----+-------------+------------
  3 | John        |    5000.00
  2 | Suraj Aswal | 4001000.00
  1 | Suraj       |    9000.00
(3 rows)


new_practice_db=*# COMMIT;
COMMIT
new_practice_db=# ROLLBACK;
WARNING:  there is no transaction in progress
ROLLBACK
new_practice_db=# BEGIN;
BEGIN
new_practice_db=*# UPDATE accounts SET balance = balance - 1000000 WHERE id=
2;
UPDATE 1
new_practice_db=*# SELECT * FROM accounts;
 id |    name     |  balance
----+-------------+------------
  3 | John        |    5000.00
  1 | Suraj       |    9000.00
  2 | Suraj Aswal | 3001000.00
(3 rows)


new_practice_db=*# UPDATE accounts SET balance = balance + 1000000 WHERE id=
1;
UPDATE 1
new_practice_db=*# SELECT * FROM accounts;
 id |    name     |  balance
----+-------------+------------
  3 | John        |    5000.00
  2 | Suraj Aswal | 3001000.00
  1 | Suraj       | 1009000.00
(3 rows)


new_practice_db=*# ROLLBACK;
ROLLBACK
new_practice_db=# SELECT * FROM accounts;
 id |    name     |  balance
----+-------------+------------
  3 | John        |    5000.00
  2 | Suraj Aswal | 4001000.00
  1 | Suraj       |    9000.00
(3 rows)


new_practice_db=#